{
  "schemaVersion": "4.1.0",
  "skillName": "api-sql-fixture-preparer",
  "manifestType": "db-fixture-report",
  "updatedAt": "2026-05-23T19:41:27+08:00",
  "executionId": "Common",
  "apiId": "COMMON.depositcommonutil.getdawhofixsetting",
  "status": "skipped",
  "phase": "no_sql",
  "executionMode": "prepare",
  "dbTarget": "connection-name:Report",
  "authorityRoot": "../../.agent/reference/global",
  "sqlFixtureRequired": false,
  "sourcesUsed": [],
  "tableRefs": [],
  "summary": {
    "tableCount": 0,
    "blockingTableCount": 0,
    "queryTextCount": 0
  },
  "message": "COMMON.depositcommonutil.getdawhofixsetting fixture skipped: no SQL dependency.",
  "findings": []
}
