{
  "schemaVersion": "4.1.0",
  "skillName": "api-sql-fixture-preparer",
  "manifestType": "db-fixture-report",
  "updatedAt": "2026-05-23T19:47:00+08:00",
  "executionId": "Common",
  "apiId": "COMMON.commonfunc.addiristransactionrecord",
  "status": "blocked",
  "phase": "inspection_blocked",
  "executionMode": "prepare",
  "dbTarget": "connection-name:Report",
  "authorityRoot": "../../.agent/reference/global",
  "sqlFixtureRequired": true,
  "sourcesUsed": [
    "codeHandoff.queryContracts",
    "businessLogic.sqlSpecs",
    "backendApis"
  ],
  "tableRefs": [
    "DaWho.dbo.IRISTransactionRecord",
    "DAWHO.DBO.IRISTRANSACTIONRECORD"
  ],
  "summary": {
    "tableCount": 2,
    "blockingTableCount": 0,
    "queryTextCount": 1
  },
  "message": "COMMON.commonfunc.addiristransactionrecord fixture blocked: missing_schema_authority",
  "findings": [
    {
      "tableRef": "DaWho.dbo.IRISTransactionRecord",
      "action": "create",
      "blockReason": "missing_schema_authority"
    },
    {
      "tableRef": "DAWHO.DBO.IRISTRANSACTIONRECORD",
      "action": "create",
      "blockReason": "missing_schema_authority"
    }
  ]
}
