{
  "schemaVersion": "4.1.0",
  "skillName": "api-sql-fixture-preparer",
  "manifestType": "db-fixture-report",
  "updatedAt": "2026-05-23T19:42:30+08:00",
  "executionId": "Common",
  "apiId": "COMMON.commonfunc.getfrontcontentparamfile",
  "status": "blocked",
  "phase": "inspection_blocked",
  "executionMode": "prepare",
  "dbTarget": "connection-name:Report",
  "authorityRoot": "../../.agent/reference/global",
  "sqlFixtureRequired": true,
  "sourcesUsed": [
    "codeHandoff.queryContracts",
    "businessLogic.sqlSpecs"
  ],
  "tableRefs": [
    "FrontContent_ParamFile"
  ],
  "summary": {
    "tableCount": 1,
    "blockingTableCount": 1,
    "queryTextCount": 1
  },
  "message": "COMMON.commonfunc.getfrontcontentparamfile fixture blocked: missing_schema_authority",
  "findings": [
    {
      "tableRef": "FrontContent_ParamFile",
      "action": "create",
      "blockReason": "missing_schema_authority"
    }
  ]
}
